	Restaurant	Food restrictions	Menu	Menu Eng
365	MorriSon's Helsinki	['Gluten-free', 'Vegan', 'Vegetarian']	Burgers | KING KONG (G) : Kaksi naudan täyslihapihviä, cheddarjuustoa, paistettua pekonia, paneroitu sipulirengas, paprikamajoneesia, BBQ-kastiketta, salaattia, tomaattia ja marinoitua punasipulia	Burgers / KING KONG (G): two beef full-meat patties, cheddar cheese, fried bacon, panned onion ring, paprika mayonnaise, BBQ sauce, lettuce, tomato and pickled red onion
366	MorriSon's Helsinki	['Gluten-free', 'Vegan', 'Vegetarian']	Desserts | MILKSHAKE : Morrisonin pirtelö valitsemallasi maulla: Vanilja, suklaa, mansikka tai Oreo	Desserts | MILKSHAKE: Morrison's milkshake of your choice: vanilla, chocolate, strawberry or Oreo
367	Il Siciliano Espa	['Gluten-free', 'Vegan', 'Vegetarian']	Antipasti | Munakoisoa Parmigiana G : Eggplant Parmigiana	Antipasti / Eggplant Parmigiana G: Eggplant Parmigiana
368	Il Siciliano Espa	['Gluten-free', 'Vegan', 'Vegetarian']	Antipasti | Valikoima liha-juustotäytteisiä arancineja, kirsikkatomaattidippi : A selection of arancini filled with meat and cheese, cherry tomato dip	Antipasti / selection of arancini stuffed with meat and cheese, cherry tomato dip : a selection of arancini filled with meat and cheese, cherry tomato dip
369	Il Siciliano Espa	['Gluten-free', 'Vegan', 'Vegetarian']	Antipasti | Tonnikalacarpaccio, kaprisjäätelöä, sokeroitua sitruunaa ja oliiveja G : Tuna carpaccio with caper ice cream, candied lemon and olives earth	Antipasti / tuna carpaccio, caper ice cream, candied lemon and olives G : Tuna carpaccio with caper ice cream, candied lemon and olives earth
370	Il Siciliano Espa	['Gluten-free', 'Vegan', 'Vegetarian']	Mains | Gnocchipastaa, pestoa trapanilaisittain : Gnocchi with pesto alla Trapanese(Vegan upon request)	Mains / gnocchi pasta, pesto trapanese: Gnocchi with pesto alla Trapanese (Vegan upon request)
371	Il Siciliano Espa	['Gluten-free', 'Vegan', 'Vegetarian']	Mains | Paistettua mustekalaa, caponataa ja tapenadea aurinkokuivatuista tomaateista L, G : Pan-fried octopus served with caponata and sundried tomato tapenade	Mains / fried octopus, caponata and tapenade from sun-dried tomatoes L, G: Pan-fried octopus served with caponata and sundried tomato tapenade
372	Il Siciliano Espa	['Gluten-free', 'Vegan', 'Vegetarian']	Mains | Härän sisäfileetä (180g) ja vihanneksia vartaassa, nero d'avola -kastiketta L,G : Beef tenderloin and vegetable skewer served with nero d’avola sauce	Mains / Ox tenderloin (180g) and vegetables on a skewer, nero d'avola sauce L, G: Beef tenderloin and vegetable skewer served with nero d'avola sauce
373	Il Siciliano Espa	['Gluten-free', 'Vegan', 'Vegetarian']	Desserts | Sisilialainen cannolo : Cannolo siciliano	Desserts | Sicilian cannolo: Cannolo siciliano
374	Il Siciliano Espa	['Gluten-free', 'Vegan', 'Vegetarian']	Desserts | Kahvigranità, kermavaahtoa, lämmin briossi sisilialaisittain : Caffè granita and whipped cream served with warm Sicilian brioche	Desserts / coffee Granità, whipped cream, warm brioche Sicilian style: Caffè granita and whipped cream served with warm Sicilian brioche
375	Il Siciliano Espa	['Gluten-free', 'Vegan', 'Vegetarian']	Desserts | Manteli-pistaasitiramisù G : Almonds and pistachios tiramisu	Desserts | almond pistachio tiramisù G: Almonds and pistachios tiramisu
376	Viinibaari Apotek / Wine Bar Apotek	['Gluten-free', 'Vegan', 'Vegetarian']	Sides | Sardiineja / Nokkakalaa oliiviöljyssä (sis. leipä) : Sardines / garfish in olive oil bread included	Sides / sardines / beak fish in olive oil (incl. bread): Sardines / garfish in olive oil bread included
377	Viinibaari Apotek / Wine Bar Apotek	['Gluten-free', 'Vegan', 'Vegetarian']	Sides | Oliivit : Olives	Sides / Olives : Olives
378	Viinibaari Apotek / Wine Bar Apotek	['Gluten-free', 'Vegan', 'Vegetarian']	Mains | Kukkakaalia, fetaa & omenaa (G) : Cauliflower, feta & apple (G)	Mains / cauliflower, feta & Apple (G): Cauliflower, feta & apple (G)
379	Viinibaari Apotek / Wine Bar Apotek	['Gluten-free', 'Vegan', 'Vegetarian']	Mains | Kirjolohta, melonia & mätiä (L, G) : Rainbow trout, melon & roe (G)	Mains / rainbow trout, melon & Roe (L, G) : Rainbow trout, melon & roe (G)
380	Viinibaari Apotek / Wine Bar Apotek	['Gluten-free', 'Vegan', 'Vegetarian']	Mains | Tartar, savustettua luuydintä & piparjuurta (L) (FI) : Beef tartar, smoked bone marrow, horseradish (L)	Mains / Tartar, smoked bone marrow & horseradish (L) (FI) : Beef tartar, smoked bone marrow, horseradish (L)
381	Viinibaari Apotek / Wine Bar Apotek	['Gluten-free', 'Vegan', 'Vegetarian']	Mains | Selleriä, salviaa & voita (V,G) : Celeriac, sage & butter	Mains / celery, sage & butter (V, G): Celeriac, sage & butter
382	Viinibaari Apotek / Wine Bar Apotek	['Gluten-free', 'Vegan', 'Vegetarian']	Set Menu | Keittiön 4 ruokalajin menu : Chef`s 4 course menu	Set Menu / Kitchen 4 course menu: Chef's 4 course menu
383	Kissakahvila Helkatti	['Gluten-free', 'Vegan', 'Vegetarian']	Mains | Kermainen sienipasta (L) : Fettuccine-pastaa, juustolastuja ja metsäsieniä	Mains / creamy mushroom paste (L): Fettuccine pasta, cheese chips and wild mushrooms
384	Kissakahvila Helkatti	['Gluten-free', 'Vegan', 'Vegetarian']	Mains | Halloumisalaatti (L) : Runsaalla sitruunaisella salaattipedillä halloumia, granaattiomenan siemeniä ja hedelmää.	Mains / halloumi salad (L) : a generous bed of lemon salad with halloumi, pomegranate seeds and fruit.
385	Kissakahvila Helkatti	['Gluten-free', 'Vegan', 'Vegetarian']	Desserts | Kinuskin karnevaalijäätelöannos : Jäätelä, kinuskikastiketta, kermavaahtoa, vaahtokarkkeja, hedelmäkarkkeja, strösseliä ja vohvelisikari	Desserts / caramel Carnival ice cream: ice cream, caramel sauce, whipped cream, marshmallows, fruit candies, sprinkles and waffle cigar
386	Ravintola Georgian Vibe	['Vegan', 'Vegetarian']	Starters | Phkali valikoima G,L/M,V : (Vihreitä papuja,pinaattia ja saksanpähkinöitä)	Starters / Phkali range G, L / M, A: (green beans, spinach and walnuts)
387	Ravintola Georgian Vibe	['Vegan', 'Vegetarian']	Starters | Badrijani G,L/M,V : (Saksanpähkinöillä ja georgialaisilla yrteillä täytettyjä munakoisoja)	Starters / Badrijani G, L / M, A: (aubergines stuffed with walnuts and Georgian herbs)
388	Ravintola Georgian Vibe	['Vegan', 'Vegetarian']	Starters | Satsivi katmis G,L/M : (kanaa saksanpähkinäkastikkeessa)	Starters / Satsivi katmis G, L / M: (chicken in walnut sauce)
389	Ravintola Georgian Vibe	['Vegan', 'Vegetarian']	Mains | Lobio ruukussa G,L/M,V : (Ruskeita papuja ja yrttejä)	Mains / Lobio in pot G, L / M, V: (brown beans and herbs)
390	Ravintola Georgian Vibe	['Vegan', 'Vegetarian']	Mains | Chashushuli G,L/M : (Naudanlihaa, tomaattia ja yrttejä)	Mains / Chashushuli G, L / M: (beef, tomato and herbs)
391	Ravintola Georgian Vibe	['Vegan', 'Vegetarian']	Mains | Mtsvadi kananliha G,L/M : (Shashlik kananlihasta)	Mains / Mtsvadi chicken meat G,L/M : (Shashlik chicken meat)
392	Ravintola Georgian Vibe	['Vegan', 'Vegetarian']	Desserts | Churchxela : (lankaan pujotettuja pähkinöitä, joita kastetaan jauhon ja sokerin sekoituksessa)	Desserts / Churchxela: (nuts threaded into yarn, dipped in a mixture of flour and sugar)
393	Ravintola Georgian Vibe	['Vegan', 'Vegetarian']	Desserts | Khilis asorti G,L/M,V : (sesongin hedelmät)	Desserts / Khilis asorti G, L / M, A: (seasonal fruits)
394	Ravintola Georgian Vibe	['Vegan', 'Vegetarian']	Desserts | Napaleon kakku : (Vaalea kakku)	Desserts / Napaleon cake : (light cake)
395	Siipiweikot Kamppi	['Gluten-free', 'Vegetarian']	Starters | Ristikkoperunat (L, pyydettäessä VEG) : & aurajuustodippi (VL)5,50 € / 6,90 €	Starters | Lattice potatoes (L, VEG on request): & aura cheese dip (VL)5.50 € / 6.90 €
396	Siipiweikot Kamppi	['Gluten-free', 'Vegetarian']	Starters | Chicken Fingers : sis. 4 kpl paneroituja kanan sisäfileitä, porkkana- & kurkkutikkuja sekä remouladedipin	Starters / Chicken Fingers: incl. 4 pieces of breaded chicken tenderloin, carrot & cucumber sticks and remouladedip
397	Siipiweikot Kamppi	['Gluten-free', 'Vegetarian']	Mains | Siiwet : 100 % Suomalaista broileria. (L, pyydettäessä G)16 kpl (SUOSITTU!)	Mains / Siiwet: 100% Finnish chicken. (L, G on request) 16 pieces (popular!)
398	Siipiweikot Kamppi	['Gluten-free', 'Vegetarian']	"Mains | Siiwege : Ylöjärvellä tehty, seitanista valmistettu vegaaninen ""siipi"". (L, VEG)n. 10 kpl (SUOSITTU!)"	"Mains / Siiwege: vegan ""wing""made in Ylöjärvi, made from seitan. (L, VEG)approx. 10 pieces (popular!)"
399	Siipiweikot Kamppi	['Gluten-free', 'Vegetarian']	Mains | Boneless : 100 % Suomalaista broileria. Paneroitu luuton kanan paistipala. (L)n. 8 kpl (SUOSITTU!)	Mains / Boneless: 100% Finnish chicken. Breaded boneless chicken roast. (L)about 8 pieces (popular!)
400	Georgian Supra	['Gluten-free', 'Vegan', 'Vegetarian']	Starters | Georgian Gobi : A colorful assortment  of walnut-stuffed and garlic sour cream-stuffed eggplant rolls, Georgian style bean, beetroot, spinach and green bean pkhali, tomato-cucumber salad, and crispy cornbread (Vegan option available) (L, G, VE)	Starters / Georgian Gobi: A colorful assortment of walnut-stuffed and garlic sour cream-stuffed eggplant rolls, Georgian style bean, beetroot, spinach and green bean pkhali, tomato-cucumber salad, and crispy cornbread (Vegan option available) (L, G, VE)
401	Georgian Supra	['Gluten-free', 'Vegan', 'Vegetarian']	Starters | Gebzhalia with Elarji Balls : Megrelian (Western Georgia) dish of soft sulguni cheese folded in a light mint yogurt sauce, served with warm, stretchy cornmeal elarji.	Starters / Gebzhalia with Elarji Balls : Megrelian (Western Georgia) dish of soft sulguni cheese folded in a light mint yogurt sauce, served with warm, stretchy cornmeal elarji.
402	Georgian Supra	['Gluten-free', 'Vegan', 'Vegetarian']	Salads | Warm Garlic Chicken Salad : Shredded chicken with creamy garlic dressing, vegetables, and herbs (L)	Salads | Warm Garlic Chicken Salad : Shredded chicken with creamy garlic dressing, vegetables, and herbs (L)
403	Georgian Supra	['Gluten-free', 'Vegan', 'Vegetarian']	Salads | Georgian Salad : Georgian style cucumber-and-tomato salad with walnut.	Salads / Georgian Salad : Georgian style cucumber-and-tomato salad with walnut.
404	Georgian Supra	['Gluten-free', 'Vegan', 'Vegetarian']	Signature | Chakapuli : Our restaurant's royal dish. Lamb cooked with white wine, tarragon, sour plums, and herbs. A true Georgian classic full of rich, bright flavors (G. L)	Signature / Chakapuli: Our restaurant's royal dish. Lamb cooked with white wine, tarragon, sour plums, and herbs. A true Georgian classic full of rich, bright flavors (G. L)
405	Georgian Supra	['Gluten-free', 'Vegan', 'Vegetarian']	Signature | Creamy Calf Chakapuli : Calf cooked in a light tarragon and herb cream sauce, served with warm aligo and crispy bread sticks.	Signature / Creamy Calf Chakapuli: Calf cooked in a light tarragon and herb cream sauce, served with warm aligo and crispy bread sticks.
406	Georgian Supra	['Gluten-free', 'Vegan', 'Vegetarian']	Signature | Shkmeruli : Traditional Georgian chicken cooked in creamy garlic sauce, made in the authentic village style (L, G)	Signature / Shkmeruli: Traditional Georgian chicken cooked in creamy garlic sauce, made in the authentic village style (L, G)
407	Georgian Supra	['Gluten-free', 'Vegan', 'Vegetarian']	Signature | Chashushuli : Slow-cooked beef stew with tomatoes, onions, and Georgian spices, rich in flavor and warmth. Comes with bread (G. L)	Signature / Chashushuli: Slow-cooked beef stew with tomatoes, onions, and Georgian spices, rich in flavor and warm. Comes with bread (G. L)
408	Georgian Supra	['Gluten-free', 'Vegan', 'Vegetarian']	Signature | Qalia with Pomegranate : Tender pork mixed with fragrant herbs, garlic, and sharo vinegar, enriched with sweet-tart pomegranate seeds for a bold. comforting Georgian flavor. Served with creamy mashed potatoes as a side	Signature / Qalia with Pomegranate : Tender pork mixed with fragrant herbs, garlic, and sharo vinegar, enriched with sweet-tart pomegranate seeds for a bold. comforting Georgian flavor. Served with creamy mashed potatoes as a side
409	Georgian Supra	['Gluten-free', 'Vegan', 'Vegetarian']	Pastries | Adjaruli Hatsapuri with Mint and Spinach : Boat-shaped baked bread filled with melted cheese, spinach, mint, and a knob of butter (VE)	Pastries / Adjaruli Hatsapuri with Mint and Spinach : Boat-shaped baked bread filled with melted cheese, spinach, mint, and a knob of butter (VE)
410	Georgian Supra	['Gluten-free', 'Vegan', 'Vegetarian']	Pastries | Double Hatsapuri : Cheese-filled round bread topped with extra melted cheese and baked to a golden finish (VE)	Pastries / Double Hatsapuri: Cheese-filled round bread topped with extra melted cheese and baked to a golden finish (VE)
411	Pueblo Bar y Taqueria	['Gluten-free', 'Vegan', 'Vegetarian']	Mains | Carnitas : Homemade corn tortillas.n3-4 Tacos served with Mexican rice & refried black beans. With slow-cooked pork neck. Topped with coriander and onion.2 x 8.00 €3 x 12.30 €4x 14.90 €	Mains / Carnitas: Homemade corn tortillas.n3 - 4 Tacos served with Mexican rice & refried black beans. With slow-cooked pork neck. Topped with coriander and onion.2 x 8.00 €3 x 12.30 €4x 14.90 €
412	Pueblo Bar y Taqueria	['Gluten-free', 'Vegan', 'Vegetarian']	Mains | Camarones : Homemade corn tortillas. 3-4 Tacos served with Mexican rice & refried black beans with tiger prawns marinated in spicy habanero sauce. Topped with avocado, coriander and onion.2 x 9.50 €3 x 14.60 €4 x 17.60 €	Mains / Camarones: Homemade corn tortillas. 3-4 Tacos served with Mexican rice & refried black beans with tiger prawns marinated in spicy habanero sauce. Topped with avocado, coriander and onion.2 x 9.50 €3 x 14.60 €4 x 17.60
413	Pueblo Bar y Taqueria	['Gluten-free', 'Vegan', 'Vegetarian']	Mains | Verduras : Homemade corn tortillas. 3-4 Tacos served with Mexican rice & refried black beans with cauliflower, broccholi, zucchini with melted cheese. Topped with coriander and onion.2 x 8.00 €3 x 12.30 €4 x 14.90 €	Mains / Verduras : Homemade corn tortillas. 3-4 Tacos served with Mexican rice & refried black beans with cauliflower, broccholi, zucchini with melted cheese. Topped with coriander and onion.2 x 8.00 €3 x 12.30 €4 x 14.90
414	Pueblo Bar y Taqueria	['Gluten-free', 'Vegan', 'Vegetarian']	Desserts | House ice creams : Ask at the bar and we’ll let you know what’s in the freezer	Desserts | House ice creams: Ask at the bar and we'll let you know what's in the freezer
415	Pueblo Bar y Taqueria	['Gluten-free', 'Vegan', 'Vegetarian']	Snacks | Nachos con guacamole : Corn tortilla chips served with fresh made guacamole.	Snacks / Nachos con guacamole : Corn tortilla chips served with fresh made guacamole.
416	Pueblo Bar y Taqueria	['Gluten-free', 'Vegan', 'Vegetarian']	Snacks | Quesadillas simples : Wheat tortillas filled with cheese, topped with sallad, onion and coriander	Snacks | Quesadillas simples: Wheat tortillas filled with cheese, topped with sallad, onion and coriander
417	Pueblo Bar y Taqueria	['Gluten-free', 'Vegan', 'Vegetarian']	Snacks | Choriqueso : Wheat tortilla filled with Chorizo, potatoe, onion and melted cheese. Served with house chipotle salsa and topped with coriander and onion.	Snacks / Choriqueso : Wheat tortilla filled with Chorizo, potatoe, onion and melted cheese. Served with house chipotle salsa and topped with coriander and onion.
418	Brokadi Tripla	['Gluten-free', 'Vegan', 'Vegetarian']	Starters | Sichuan Beef salad with Sichuan pepper oil	Starters | Sichuan Beef salad with Sichuan pepper oil
419	Brokadi Tripla	['Gluten-free', 'Vegan', 'Vegetarian']	Starters | Sichuan chilli oil dumplings 6 pcs	Starters / Sichuan chilli oil dumplings 6 pcs
420	Brokadi Tripla	['Gluten-free', 'Vegan', 'Vegetarian']	Starters | Soft tofu pudding with Sichuan pepper oil	Starters / Soft tofu pudding with Sichuan pepper oil
421	Brokadi Tripla	['Gluten-free', 'Vegan', 'Vegetarian']	Soups | Mushroom and chicken soup	Soups | Mushroom and chicken soup
422	Brokadi Tripla	['Gluten-free', 'Vegan', 'Vegetarian']	Soups | Soup noodle with chicken and mushroom	Soups / Soup noodle with chicken and mushroom
423	Brokadi Tripla	['Gluten-free', 'Vegan', 'Vegetarian']	Soups | Hot and sour rice noodle	Soups / Hot and sour rice noodle
424	Brokadi Tripla	['Gluten-free', 'Vegan', 'Vegetarian']	Mains | Brokadi dry fried frog with Sichuan pepper	Mains / Brocade dry fried frog with Sichuan pepper
425	Brokadi Tripla	['Gluten-free', 'Vegan', 'Vegetarian']	Mains | Instant spicy steam hotpot (for 2 persons)	Mains / Instant spicy steam hotpot (for 2 persons)
426	Brokadi Tripla	['Gluten-free', 'Vegan', 'Vegetarian']	Mains | Brokadi BoBo mix pot (28 sticks)	Mains / Brocade BoBo mix pot (28 sticks)
427	Brokadi Tripla	['Gluten-free', 'Vegan', 'Vegetarian']	Mains | Hot tender chicken with fresh green chili	Mains / Hot tender chicken with fresh green chili
428	Brokadi Tripla	['Gluten-free', 'Vegan', 'Vegetarian']	Mains | Black pepper flavoured beef with fresh mushroom	Mains / Black pepper flavoured beef with fresh mushroom
429	Brokadi Tripla	['Gluten-free', 'Vegan', 'Vegetarian']	Mains | Sweet and sour tenderloin	Mains / Sweet and sour tenderloin
430	Brokadi Tripla	['Gluten-free', 'Vegan', 'Vegetarian']	Vegan | Dry fried cauliflower and broccoli	Vegan / Dry fried cauliflower and broccoli
431	Brokadi Tripla	['Gluten-free', 'Vegan', 'Vegetarian']	Vegan | Fried lotus root slices with green bean and mushroom	Vegan / Fried lotus root slices with green bean and mushroom
432	Brokadi Tripla	['Gluten-free', 'Vegan', 'Vegetarian']	Vegan | Brokadi cumin flavoured vegan mix pot	Vegan / Brocade cumin flavoured vegan mix pot
433	Brokadi Tripla	['Gluten-free', 'Vegan', 'Vegetarian']	Desserts | Fried banana with ice cream	Desserts / Fried banana with ice cream
434	Capperi - Tripla	['Vegetarian']	Starters | Tagliere Capperi : Pizzasuikaleiden kanssa bufala-mozzarellaa, gorgonzolaa ja pecorino-juustoa, San Daniele-ilmakuivattua kinkkua, italialaista kinkkua, sopressata-salamia, ndujaa, Caiazzo-oliiveja ja tonnikalalla täytettyä paprikaa (kahdelle)	Starters | Tagliere Capperi: with pizza strips of bufala mozzarella, gorgonzola and pecorino cheese, San Daniele air-dried ham, Italian ham, sopressata salami, nduja, Caiazzo olives and tuna-stuffed paprika (for two)
435	Capperi - Tripla	['Vegetarian']	Kids Menu | Lasten Margherita kinkulla	Kids Menu / children's Margherita with ham
436	Capperi - Tripla	['Vegetarian']	Kids Menu | Lasten Margherita	Kids Menu / Children's Margherita
437	Capperi - Tripla	['Vegetarian']	Kids Menu | Lasten Margherita salamilla	Kids Menu / children's Margherita salami
438	Capperi - Tripla	['Vegetarian']	Pizza | Margherita DOP : Tomaattikastike San Marzino-tomaateista, mozzarellaa ja tuoretta basilikaa	Pizza | Margherita DOP: tomato sauce with San Marzino tomatoes, mozzarella and fresh basil
439	Capperi - Tripla	['Vegetarian']	Pizza | Diavola Calabrese : Tomaattikastike San Marzano-tomaateista, mozzarellaa, Calabrian soppressata-salamia, tulista ja mausteista N'duja-salamilevitettä ja tuoretta basilikaa	Pizza / Diavola Calabrese: tomato sauce with San Marzano tomatoes, mozzarella, Calabrian soppressata salami, spicy and spicy n'duja salami spread and fresh basil
440	Capperi - Tripla	['Vegetarian']	Pizza | Capperi! : Mozzarellaa, keltaisia ja punaisia Piennolo-tomaatteja, kapriksia Salinasta, Caiazo-oliiveja ja tuoretta basilikaa	Pizza / Capper! : Mozzarella, yellow and red Piennolo tomatoes, capers from Salina, Caiazo olives and fresh basil
441	Ravintola Central	['Gluten-free', 'Vegan', 'Vegetarian']	Starters | Etanapannu (L) : Sinihomejuustolla kuorrutettuja etanoita valkosipulivoissa sekä talon leipää.	Starters / snail Pan (L) : snails with blue cheese in garlic butter and house bread.
442	Ravintola Central	['Gluten-free', 'Vegan', 'Vegetarian']	Mains | Pippuripihvi (L)(G) : 150 g mureaa naudan ulkofileetä, kermaista mustapippurikastiketta, lämpimiä sesongin kasviksia ja uuniperunaa.	Mains / Pepper Steak(L) (G) : 150 g tender beef sirloin, creamy black pepper sauce, warm seasonal vegetables and baked potatoes.
443	Ravintola Central	['Gluten-free', 'Vegan', 'Vegetarian']	Mains | Centun kanaa (L)(G) : Hunajaista kermakastiketta, lämpimiä kasviksia ja ranskanperunoita.	Mains / Centun chicken (L)(G) : honeyed cream sauce, warm vegetables and french fries.
444	Ravintola Central	['Gluten-free', 'Vegan', 'Vegetarian']	Mains | Centun Burger (L) : Rotukarjan burgerpihvi (160 g), jääsalaattia, tomaattia, punasipulia, cheddarjuustoa, BBQ-kastiketta ja chilimajoneesia. Burgerin kaveriksi ranskalaisia.	Mains / Centun Burger (L) : beef burger (160 g), lettuce, tomato, red onion, cheddar cheese, BBQ sauce and chilli mayonnaise. Burger guy, fries.
445	Ravintola Central	['Gluten-free', 'Vegan', 'Vegetarian']	Mains | Paistettua maksaa ja rapeaa pekonia (L, G) : Kermakastiketta, perunasosetta, sokeroitua puolukkaa, rapeaa pekonia ja lämpimiä kasviksia.	Mains / fried liver and crispy bacon (L, G): cream sauce, mashed potatoes, candied lingonberries, crispy bacon and warm vegetables.
446	Mamma Rosa	['Vegetarian']	"Starters | Yrtti-valkosipulikuorrutetut etanat	L : Snails with garlic and herb butter"	Starters / herb-garlic slugs L: Snails with garlic and herb butter
447	Mamma Rosa	['Vegetarian']	Starters | Buffalomozzarella-tomaattibruschetta VL,SG : Bufala mozzarella and tomato bruschetta	Starters | Buffalomozzarella-tomato bruschetta VL, SG: Bufala mozzarella and tomato bruschetta
448	Mamma Rosa	['Vegetarian']	Starters | Raputoast Mamma Rosa, lohenmätiä L, SG : Shrimp toast with roe of salmon	Starters | crab toast Mamma Rosa, salmon roe L, SG : Shrimp toast with roe of salmon
449	Mamma Rosa	['Vegetarian']	Mains | Vuohenjuustoa ja portobellosientä, valkosipulipastaa VL : Goat cheese and portobello mushroom, garlic pasta	Mains / goat cheese and portobello mushroom, garlic paste VL: Goat cheese and portobello mushroom, garlic pasta
450	Mamma Rosa	['Vegetarian']	Mains | Päivän tuoretta kalaa, punajuurikastiketta L,G : Fresh fish of the day, beetroot sauce	Mains / fresh fish of the day,beetroot sauce L, G : Fresh fish of the day, beetroot sauce
451	Mamma Rosa	['Vegetarian']	Mains | Grillisitruunakuorrutettua broileria, parmesanrisottoa L, G : Grilled lemon gratinated chicken, parmesan risotto	Mains / grilled lemon glazed chicken, parmesan risotto L, G: Grilled lemon gratinated chicken, parmesan risotto
452	Mamma Rosa	['Vegetarian']	Desserts | Suklaafondant, marjasorbet L : Chocolate fondant, berry sorbet	Desserts / chocolate fondant, berry sorbet L: Chocolate fondant, berry sorbet
453	Mamma Rosa	['Vegetarian']	Desserts | Vaniljapannacotta, raparperia ja mansikkaa L, G : Vanilla panna cotta, rhubarb and strawberries	Desserts | vanilla Pancotta, rhubarb and strawberry L, G : Vanilla panna cotta, rhubarb and strawberries
454	Mamma Rosa	['Vegetarian']	Desserts | Tiramisu L	Desserts / Tiramisu L
455	Pomo D'Or Hietalahti	['Gluten-free', 'Vegan', 'Vegetarian']	Antipasti | Asparagi e Burrata con Bottarga di Muggine : pehmeää parsaa klassisella Béarnaisekastikkeella, Apulian burrataa jauhetun mullet Bottarga -pulverin kanssa (jauhettua kelttikalan mätiä) ja ruisleivän muruja	Antipasti / Asparagi e Burrata con Bottarga di Muggine: soft asparagus with classic Béarnaise sauce, Apulian burrata with ground mullet Bottarga powder (ground Celtic fish roe) and rye bread crumbs
456	Pomo D'Or Hietalahti	['Gluten-free', 'Vegan', 'Vegetarian']	Antipasti | Tartare di Salmone Marinato : raavattua lohta taimenen mädin, rouhittujen pistaasipähkinöiden ja tillikastikkeen kanssa	Antipasti / Tartare di Salmone Marinato: raw salmon with trout roe, crushed pistachios and dill sauce
457	Pomo D'Or Hietalahti	['Gluten-free', 'Vegan', 'Vegetarian']	Antipasti | Veli di Bresaola Gourmet : ohueksi viipaloitua Bresaola-kinkkua Parmigiano Reggiano -lastujen, rucolan, sitruunavinaigretten ja metsämarjakastikkeen kera	Antipasti / Veli di Bresaola Gourmet: thinly sliced Bresaola Ham with Parmigiano Reggiano chips, arugula, lemon vinaigrette and Forest Berry Sauce
458	Pomo D'Or Hietalahti	['Gluten-free', 'Vegan', 'Vegetarian']	Primi Piatti | Spaghetti alla Carbonara Tradizionale : spagettia, guancialelihaa ja Pecorino Romano -juustoa, emulgoitu klassisella roomalaisella tavalla	Primi Piatti | Spaghetti alla Carbonara Tradizionale: spaghetti, guancialel beef and Pecorino Romano cheese, emulsified in the classical Roman Way
459	Pomo D'Or Hietalahti	['Gluten-free', 'Vegan', 'Vegetarian']	Primi Piatti | Risotto Primavera di Mare : parsarisottoa katkaravuilla, sitruunalla, taimenen mädillä ja parmesaanikermalla	Primi Piatti / Risotto Primavera di Mare: asparagus risotto with prawns, lemon, trout roe and parmesan cream
460	Pomo D'Or Hietalahti	['Gluten-free', 'Vegan', 'Vegetarian']	Mains | Tagliata di Entrecôte ai Frutti di Bosco : grillattua, siivutettua entrecôtepihviä metsämarjakastikkeella, annos tarjoillaan rucolan, kirsikkatomaattien, Parmigiano Reggiano -lastujen ja valkosipuliperunoiden kanssa	Mains / Tagliata di Entrecôte ai Frutti di Bosco: grilled, sliced Entrecôte steak with Forest Berry Sauce, served with arugula, cherry tomatoes, Parmigiano Reggiano chips and garlic potatoes
461	Pomo D'Or Hietalahti	['Gluten-free', 'Vegan', 'Vegetarian']	Mains | Salmone e Asparagi al Pepe Rosa : paahdettu lohifilee parsan ja rosépipippuriperunoiden kanssa tillivoikastikkeella	Mains / Salmone e Asparagi al Pepe Rosa: roasted salmon fillet with asparagus and rosé pepper potatoes with dill butter sauce
462	Pomo D'Or Hietalahti	['Gluten-free', 'Vegan', 'Vegetarian']	Desserts | Tiramisù Classico : klassinen italialainen jälkiruoka perinteiseen tapaan	Desserts | Tiramisù Classico: a classic Italian dessert in the traditional way
